{
  "id": "REC-template",
  "record_type": "paper-deep-reading",
  "status": "draft",
  "created_at": "2026-09-29T00:00:00+00:00",
  "source_refs": [],
  "artifact_refs": [],
  "fields": {
    "paper_id": null,
    "bibliography": null,
    "read_coverage": null,
    "abstract_anatomy": null,
    "problem_and_gap": null,
    "theory_and_mechanism": null,
    "design_and_data": null,
    "model_details": null,
    "validation_design": null,
    "reported_results": null,
    "figure_and_table_links": null,
    "limitations": null,
    "author_claim_vs_assessment": null,
    "transfer_conditions": null
  }
}
